{"schema":"contraste.governance.appetite/v1","governance_id":"appetite","case_id":"GOVERNANCE","schema_version":"1.0.0","as_of":"2026-10-21","as_of_basis":{"label":"convention","basis":{"en":"W15-13: the date of the newest release heading of CHANGELOG.md when the bake runs; committed, never a wall-clock date, never earlier than a raised date Here: the heading of release 0.15.000, 2026-10-21.","es":"W15-13: la fecha del encabezado de versión más reciente de CHANGELOG.md cuando corre el bake; confirmada, nunca una fecha del reloj, nunca anterior a una fecha de levantamiento Aquí: el encabezado de la versión 0.15.000, 2026-10-21."}},"provenance":{"code_version":"0.15.000","riskvalidation_version":"0.9.0","generators":["contraste:governance-bake"],"documents_read":[{"path":"CHANGELOG.md","sha256":"e8b0827adbe5222d1109eafb08a63f24b7472f7981c9be91ad1ce2830e98db8b","ref":null},{"path":"data-pipeline/pipeline/governance/edges.json","sha256":"56b5d3f1663018f905c196cbf8ebc101cc47be2c4625bec5c5ee5316727d0096","ref":null},{"path":"data-pipeline/pipeline/governance/inputs.json","sha256":"305dee7f3eefdd7530480d662ab363437e4d7230daf248281115a841b565a357","ref":null},{"path":"data/derived/C01/drift-moderate.json","sha256":"389b558449ab5fd2177e172ad9b95845b0bb0f5f62224ba04a2f7c72a949d27a","ref":null},{"path":"data/derived/C01/drift-severe.json","sha256":"1d1bbecd8527c127e373f94da04faa521a2361a5286bd22ac7e183648033f349","ref":null},{"path":"data/derived/C01/german-twin.json","sha256":"9c0ac47beecf1e5c456ea0be6997855beace3a9e9f53dd36abec031bd0d0872b","ref":null},{"path":"data/derived/C01/holdout.json","sha256":"b1f66b448c94bc0e46d59e7d64adcc62e8bbaed0d4a5a8f31d2476f6099d8c09","ref":null},{"path":"data/derived/C01/label-noise.json","sha256":"e5159ed8e70bab98f4ef8224764f57e11ce058644e93af43493e7961a9e2a225","ref":null},{"path":"data/derived/C01/models-german.json","sha256":"60aadbffd7f6cba342f239be2b0b3b8661b9d5a7114cfaa6d0f133b0a99b03e6","ref":null},{"path":"data/derived/C01/models-taiwan-small.json","sha256":"65befc0cc403dd0bfccacee1d565d812015ba1c1e1172f8816304caedc374602","ref":null},{"path":"data/derived/C01/models-taiwan.json","sha256":"bbea91367f223613fa9a95a0411dd4da077d62cc2f958a1730d06e64ea3fe396","ref":null},{"path":"data/derived/C01/prior-shift.json","sha256":"284178bde5e2d7b92e8a66c9c4ab6b4ed8ae46da64ff2b069e75ee2e5fd9aaf1","ref":null},{"path":"data/derived/C01/small-sample.json","sha256":"e2238bf1c77815a0756bb736c50171e33f4b40bf50c18db8fd761dc866ae0cac","ref":null},{"path":"data/derived/C02/h1.json","sha256":"3b72f86c759b1d8b0ae3276598408343d03fdf6af89d1d6f036c7bb3fb8f2428","ref":null},{"path":"data/derived/C02/h2.json","sha256":"24275890f0089eed4a3e7a6d0e1a28149aa7c4c4dc3e3c9d66dcc1c2103dc505","ref":null},{"path":"data/derived/C02/h3.json","sha256":"01a2e2cd2e74e778805574f94076f7ec8cb26df6c540926127cab37c176bc412","ref":null},{"path":"data/derived/C02/h4.json","sha256":"600fcd4f66bf19bdbcd7de64083470696d6f29021c2247a933c36995dcb01680","ref":null},{"path":"data/derived/C02/h5.json","sha256":"06a9f8c629ea5b880e478768171a0d978c134d92866e8f9a11db3629e49988ea","ref":null},{"path":"data/derived/C02/models-polish-horizons.json","sha256":"6059c24488d9b37dd967df2a16ed17e9515044c69daac5d387f345cbdfaf5d41","ref":null},{"path":"data/derived/C02/pooled.json","sha256":"88ed33702c332ff8396efe1a88e292b9a41cb8b32ef316ef33831e72d9f5ba7e","ref":null},{"path":"data/derived/C03/fy2006-07.json","sha256":"a6d869e54d92d5a691427f5dcda8fca3b4aee089c3313b6e1dba28fc75e56e84","ref":null},{"path":"data/derived/C03/fy2008-10.json","sha256":"90d602a834d070c9943fb73c3c70d440f1b19d5c69ec699c09fb53a3b54dfdd5","ref":null},{"path":"data/derived/C03/fy2011-14.json","sha256":"fc58d04c5f25aea8540820e223a2328c3dc0530b7cd3f29e7e07b124185b96b2","ref":null},{"path":"data/derived/C03/fy2015-17.json","sha256":"121f6f1399468a78d752053e899c8b49a52d231956fa2aae0569a6daa9eddbab","ref":null},{"path":"data/derived/C03/fy2018-20.json","sha256":"b9dc8dc7d20311b98a2be542771ba3e2ae746ee1fd25dff2c47ef192d531ab8b","ref":null},{"path":"data/derived/C03/models-sba-7a.json","sha256":"a96f65df41311e63bc41dafa16b0f239daf99aa3293e89a1d2318bc4f24a848e","ref":null},{"path":"data/derived/C04/cycle.json","sha256":"3ab570a38b717e5b6d9a26fce0cb4654e834b36d1b540b2ac581b06ba3be4239","ref":null},{"path":"data/derived/C04/fitch.json","sha256":"71454be63d544afe4ed6324b4a48bcfd9bd4e16efc393e23ca6a5abdbdb6b4c1","ref":null},{"path":"data/derived/C04/markov.json","sha256":"22d7af5e2647f533fb678638b173dc505a95a6e037099bb26b70ac270b7af631","ref":null},{"path":"data/derived/C04/models-transitions.json","sha256":"2029eb49b2902597248b220d2c871f20a2dc1a8c071c9647a2fedee92e37cb97","ref":null},{"path":"data/derived/C04/momentum.json","sha256":"8c5f5a6f812897a80dec371913501801fff1cfa89fc21a10f8664db954a7f7f5","ref":null},{"path":"data/derived/C04/moodys.json","sha256":"2306cbc38e86268873afdadfcdf4b7a393946cdf292a17e8603ea6a96f969e5a","ref":null},{"path":"data/derived/C04/published.json","sha256":"4b0026fd3a988f04fd3036395b13c8e0797afb7f9667409f7f14901d452f2b29","ref":null},{"path":"data/derived/C04/sp.json","sha256":"569ec7c5d4ac33b97cd93a329483b9811227c67f33b230d996de1ce883ae0ee0","ref":null},{"path":"data/derived/C04/thin.json","sha256":"6497ed65d3d3b6d15c53079baa58e4e745b5980ae0b9c5cfab80fd64e17d7d12","ref":null},{"path":"data/derived/C04/withdrawals.json","sha256":"a5f1655481b08dfd1fba22e4da2c35628172c25e9a39dcfa33426edd8df0bfec","ref":null},{"path":"data/derived/C05/ldp-published.json","sha256":"c3b810d56a58ab60a28d512c0b2e2f5bbed461cd8215cccf849c20986935586a","ref":null},{"path":"data/derived/C05/ldp-sim-0.json","sha256":"365cbe68c6c29de6a8b7b6b489fa3b9046204e0bfcc3272970d6d14ab0901349","ref":null},{"path":"data/derived/C05/ldp-sim-1.json","sha256":"b4ba05ac96dde9ae67550a3f2a8a90f08ec4e948bd1edcfc82e3eff2c80202ff","ref":null},{"path":"data/derived/C05/ldp-sim-3.json","sha256":"16d72a6a2e4dc39a7f7eaf6f9ccb566707bb1b4f74c9bb60a6f76f721cbb986d","ref":null},{"path":"data/derived/C05/models-ldp.json","sha256":"803c889617a1c7ad0a04840e17d1b184c7b255258d630f12d8a1c50386e9af02","ref":null},{"path":"data/derived/C05/models-sp2009.json","sha256":"88027914194d384634ff25b79c633b2d05a235afa9fcd2e54cfc1e04ab36d26f","ref":null},{"path":"data/derived/C05/sp-2010.json","sha256":"0620a1b356c0ffff4e6a79b4d383057cdf3f9e3d42b3c8956e2286e49f70820c","ref":null},{"path":"data/derived/C05/sp-2011.json","sha256":"757190e53825a0cfca1bb2b52687a95e4e32cc88774e7fb7279f3a16ae72b200","ref":null},{"path":"data/derived/C06/models-rd-2006-12.json","sha256":"5ee72078a9f88bc994ec27dfbc1dd10bce99805e37e8010ea4aae2a46e7e1293","ref":null},{"path":"data/derived/C06/models-rd-2008-12.json","sha256":"3de671bd3c59986f04f40cb20d3a94fde8aba1a9fdacdb40ad837c73a36b7a31","ref":null},{"path":"data/derived/C06/models-rd-2010-12.json","sha256":"d13147c17eaf81b4a3160a1b951dbb716ff181c35981e1911134297fa17818e7","ref":null},{"path":"data/derived/C06/models-rd-2019-12.json","sha256":"87eb340e3d1b2882eed946f0814f0a0c2813fb4c7ca226bd11b1a248656ca379","ref":null},{"path":"data/derived/C06/models-rd-2020-06.json","sha256":"b59f8d632ed97182042a7b6df9d3f5613529bb4ad0f69ae7828eee6861d88e38","ref":null},{"path":"data/derived/C06/models-rd-2023-06.json","sha256":"245f42b444962c6f8bf9ed08eee41705951c44f31d38bfda236d6c443a088165","ref":null},{"path":"data/derived/C06/rd-2006-12.json","sha256":"e35c179d2a8263458d65636ab141e3892d8831e4245450067af8285ea609dfaf","ref":null},{"path":"data/derived/C06/rd-2008-12.json","sha256":"ffff66779852e2976f370c9fe9950f4cf3f6914fb2b1b0ba7e1915ee3838d9f3","ref":null},{"path":"data/derived/C06/rd-2010-12.json","sha256":"3789fb3faaf13fe5c62bb5af2c46f80b0271c58f0909b202c45133a8412aecb5","ref":null},{"path":"data/derived/C06/rd-2019-12.json","sha256":"7b346910e9d554314307b298b73012bb507227db9b30c093bcb27c90db3fd68e","ref":null},{"path":"data/derived/C06/rd-2020-06.json","sha256":"e9307e30c41e947d4ef562406983e07382351958ff3af13cbecd52945101c12f","ref":null},{"path":"data/derived/C06/rd-2023-06.json","sha256":"4ddcd6c73af59017b002bc9e35b6a8d9553d856e2090ace0ec0e3bd8d94e52bc","ref":null},{"path":"data/derived/C07/base.json","sha256":"1e08b10e1d49419f86bbbc14fb06e82aba1faa99443bb4e799cd18ce4e7c13c5","ref":null},{"path":"data/derived/C07/combined-severe.json","sha256":"e079dfbdd14ecec8b979ab80435964e22567aaaa657defbad6744637b03cbabb","ref":null},{"path":"data/derived/C07/consumer-arrears-shock.json","sha256":"f47e32bccbe450f0582b2479302cd28a428a6601d9821fd3675b75bb838aeb99","ref":null},{"path":"data/derived/C07/house-price-fall.json","sha256":"45fa83c963f000281ceb41a63413666d415e21db4c8ace76f6fb858e288f659a","ref":null},{"path":"data/derived/C07/models-banco-andino.json","sha256":"4d0f4bb96c0ef3dee6401f711f3b59fa5a0505d062141ec7cb6eebbb5b8cc2ac","ref":null},{"path":"data/derived/C07/recession.json","sha256":"b9d02ae186c431e4f43541fc779884171be9af2fe5df4357678d2e9e2a574f1c","ref":null},{"path":"data/derived/C07/uf-inflation-spike.json","sha256":"24cb9ba1c6ec485fc74e6c9882c9bfe6d305a313ff08a65ac5af9909c2c8e01a","ref":null},{"path":"data/derived/C08/dc-2003-06.json","sha256":"902a959b55916a26675d2aa4a6564ef81947bc4a5d6af5607d33d5a24f0462b3","ref":null},{"path":"data/derived/C08/dc-2007-08.json","sha256":"b4bf707fb0748b7475d63b66be85b9d71511bf5ec4f73cb5f1c06347e21bc78e","ref":null},{"path":"data/derived/C08/dc-2009-10.json","sha256":"324b3f93c147f848af1e5cef5a524b3f64f37e9315b1fea5a6955a40cb0657b9","ref":null},{"path":"data/derived/C08/dc-2011-13.json","sha256":"43e6b37740d33f2054550646a215d693a74c61c2c5920bb321c134bd3c2fcfa5","ref":null},{"path":"data/derived/C08/dc-2014-19.json","sha256":"2d365e3a1cb023c262cc07b33102b21c16f905302cfacb38a2f25bb6c65452e4","ref":null},{"path":"data/derived/C08/dc-2020-23.json","sha256":"9c7fc1f9d9d6d588a4a2f14c3c237766b3f1aae26dcdc3b4e812ca657b58f8a8","ref":null},{"path":"data/derived/C08/models-dc-2003-06.json","sha256":"61c377655a55433bcd55c8de94c4bc6a426ab8ea46537843ce2f20b5598241bb","ref":null},{"path":"da